{
  "id": "psychotherapy",
  "title": {"zh": "psychotherapy", "en": "psychotherapy"},
  "type": "interactive-fiction",
  "status": "playable-web-build",
  "dates": {"start": "2020-04", "end": "2020-06", "context": {"zh": "本科大一春季学季，月份依据 UCSC 校历范围换算", "en": "First-year spring quarter; months inferred from the UCSC academic calendar"}},
  "team": {"size": null, "context": {"zh": "现有网站未说明", "en": "Not stated on the legacy portfolio"}},
  "roles": {"zh": ["程序开发"], "en": ["Programming"]},
  "tools": ["Ink"],
  "summary": {"zh": "本科大一春季使用 Ink 制作的网页互动叙事项目，包含分支叙事、存档与读档功能。", "en": "A web-based Ink interactive-fiction project completed during the first undergraduate spring quarter, with branching narrative and save/load functionality."},
  "design": {"goals": {"zh": [], "en": []}, "mechanics": {"zh": ["分支叙事", "存档与读档"], "en": ["Branching narrative", "Save and load"]}, "decisions": {"zh": [], "en": []}, "iteration": {"zh": [], "en": []}},
  "copy": {"resume": {"zh": [], "en": []}, "website": {"zh": "", "en": ""}, "full": {"zh": "", "en": ""}},
  "link_ids": ["psychotherapy-playable-page"],
  "sources": ["Legacy portfolio", "Public Ink web build"],
  "questions": ["项目的正式中英文名称是什么？", "故事主题、玩家目标和核心分支结构是什么？", "团队规模和你的具体程序职责是什么？"]
}
