{
  "id": "le-boulanger",
  "title": {"zh": "Le Boulanger! Bakery of Hell!", "en": "Le Boulanger! Bakery of Hell!"},
  "type": "game-jam",
  "status": "playable-web-build",
  "dates": {"start": "2021-12", "end": "2022-03"},
  "team": {"size": null, "context": {"zh": "Game Jam 团队项目", "en": "Game Jam team project"}},
  "roles": {"zh": ["程序开发", "游戏设计"], "en": ["Programming", "Game Design"]},
  "tools": ["Phaser 3", "JavaScript"],
  "summary": {"zh": "以 Hell's Bakery 名称发布的网页 Game Jam 项目，使用 Phaser 3 和 JavaScript 实现核心玩法并参与关卡节奏调优。", "en": "A web Game Jam project published as Hell's Bakery, built with Phaser 3 and JavaScript with contributions to core gameplay and level pacing."},
  "design": {"goals": {"zh": [], "en": []}, "mechanics": {"zh": [], "en": []}, "decisions": {"zh": [], "en": []}, "iteration": {"zh": ["参与关卡设计与游戏节奏调优"], "en": ["Contributed to level design and pacing"]}},
  "copy": {"resume": {"zh": [], "en": []}, "website": {"zh": "", "en": ""}, "full": {"zh": "", "en": ""}},
  "link_ids": ["le-boulanger-playable-page"],
  "sources": ["Legacy portfolio", "Confirmed prior resume facts", "Public web build"],
  "questions": ["项目的 Game Jam 名称、主题和准确开发周期是什么？", "团队规模和你实现的具体玩法模块是什么？", "关卡设计和节奏调优采用了哪些测试反馈？"]
}
