{
  "id": "mystery-room",
  "title": {"zh": "Mystery Room", "en": "Mystery Room"},
  "type": "team-project",
  "status": "unknown",
  "dates": {"start": "2022-09", "end": "2022-12", "context": {"zh": "本科大四秋季学季，月份依据 UCSC 校历范围换算", "en": "Senior-year fall quarter; months inferred from the UCSC academic calendar"}},
  "team": {"size": null, "context": {"zh": "团队项目", "en": "Team project"}},
  "roles": {"zh": ["程序开发", "关卡设计"], "en": ["Programming", "Level Design"]},
  "tools": [],
  "summary": {"zh": "现有个人网站列出的程序与关卡设计项目，当前公开素材为 Google Drive 构建压缩包。", "en": "A programming and level-design project listed on the legacy portfolio, currently represented by a Google Drive build archive."},
  "design": {"goals": {"zh": [], "en": []}, "mechanics": {"zh": [], "en": []}, "decisions": {"zh": [], "en": []}, "iteration": {"zh": [], "en": []}},
  "copy": {"resume": {"zh": [], "en": []}, "website": {"zh": "", "en": ""}, "full": {"zh": "", "en": ""}},
  "link_ids": ["mystery-room-drive"],
  "sources": ["Legacy portfolio", "Google Drive filename Mystery_Room.zip"],
  "questions": ["团队规模、引擎和目标平台是什么？", "核心玩法和关卡流程是什么？", "你具体负责哪些程序和关卡内容？", "Drive 构建是否能匿名下载和运行？"]
}
