{
  "id": "room-without-wall",
  "title": {"zh": "A Room Without Wall", "en": "A Room Without Wall"},
  "type": "game-jam",
  "status": "completed",
  "dates": {"start": "2021-12", "end": "2022-03"},
  "team": {"size": null, "context": {"zh": "Game Jam 小团队", "en": "Small Game Jam team"}},
  "roles": {"zh": ["团队组织", "游戏策划", "程序开发"], "en": ["Team Organization", "Game Design", "Programming"]},
  "tools": ["Unity", "Shader"],
  "summary": {"zh": "Game Jam 团队项目，通过自定义 Unity Shader 将平面场景投射到球面，形成独特的空间体验。", "en": "A Game Jam team project using a custom Unity shader to project a planar scene onto a sphere and create a distinctive spatial experience."},
  "design": {"goals": {"zh": [], "en": []}, "mechanics": {"zh": [], "en": []}, "decisions": {"zh": ["将平面场景投射至球面"], "en": ["Project the planar scene onto a sphere"]}, "iteration": {"zh": [], "en": []}},
  "copy": {"resume": {"zh": ["组织小团队完成游戏策划与开发，并编写 Unity Shader 将平面场景投射至球面。"], "en": ["Organized a small team and authored a Unity shader that projected the planar scene onto a sphere."]}, "website": {"zh": "", "en": ""}, "full": {"zh": "", "en": ""}},
  "link_ids": [],
  "sources": ["Confirmed resume facts"],
  "questions": ["项目的准确 Game Jam 名称和日期是什么？", "团队共有多少人，各自职责是什么？", "是否有公开试玩、视频、截图或源码链接？", "核心玩法和关卡目标是什么？"]
}
