{
  "id": "slacker-simulator",
  "title": {"zh": "Slacker Simulator", "en": "Slacker Simulator"},
  "type": "team-project",
  "status": "source-unavailable",
  "dates": {"start": "", "end": ""},
  "team": {"size": null, "context": {"zh": "现有网站未说明", "en": "Not stated on the legacy portfolio"}},
  "roles": {"zh": ["程序开发", "游戏设计"], "en": ["Programming", "Game Design"]},
  "tools": [],
  "summary": {"zh": "现有个人网站列出的程序与设计项目；原 Google Drive 文件目前连项目本人也无法访问，因此不作为当前公开展示素材。", "en": "A programming and design project from the legacy portfolio. Its original Google Drive file is no longer accessible even to the owner, so it is not used as a current public portfolio asset."},
  "design": {"goals": {"zh": [], "en": []}, "mechanics": {"zh": [], "en": []}, "decisions": {"zh": [], "en": []}, "iteration": {"zh": [], "en": []}},
  "copy": {"resume": {"zh": [], "en": []}, "website": {"zh": "", "en": ""}, "full": {"zh": "", "en": ""}},
  "link_ids": ["slacker-simulator-drive"],
  "sources": ["Legacy portfolio", "Unavailable Google Drive link", "Owner access confirmation"],
  "questions": ["项目内容、日期、团队、引擎和玩法是什么？", "你具体负责哪些程序与设计工作？", "是否还有本地备份、截图、视频或其他可访问的项目资料？"]
}
